title,price,text,created_at
Mao's Last Dancer,77,in lacus curabitur at ipsum ac tellus semper interdum mauris ullamcorper,2022-04-05 04:33:06
Maid of Salem,70,nulla sed vel enim sit amet nunc viverra dapibus nulla suscipit,2005-10-16 05:30:45
NATO's Secret Armies (Gladio: L'esercito segreto della Nato),80,vehicula condimentum curabitur in libero ut massa volutpat convallis morbi,2008-11-09 00:52:45
"Boy with Green Hair, The",23,lorem id ligula suspendisse ornare consequat lectus in est risus auctor sed tristique in tempus sit amet sem fusce consequat,2014-11-19 03:37:17
Back In Action,51,mi in porttitor pede justo eu massa donec dapibus duis at velit eu est congue elementum in hac habitasse platea,2004-12-18 14:43:38
The Message,80,pellentesque volutpat dui maecenas tristique est et tempus semper est quam pharetra,2012-12-14 15:15:58
"Defender, The",43,sapien urna pretium nisl ut volutpat sapien arcu sed augue aliquam erat volutpat in congue,2013-07-21 18:03:05
"Savage Nights (Nuits fauves, Les)",63,convallis morbi odio odio elementum eu interdum eu tincidunt in leo maecenas pulvinar,2004-01-19 23:22:44
In Search of the Castaways,48,vestibulum eget vulputate ut ultrices vel augue vestibulum ante ipsum primis in faucibus orci luctus et ultrices posuere cubilia,2006-06-05 04:59:01
Surviving Desire,55,egestas metus aenean fermentum donec ut mauris eget massa tempor convallis nulla neque libero convallis eget eleifend,2001-07-06 19:08:28
"Man from Utah, The",70,cursus urna ut tellus nulla ut erat id mauris vulputate elementum nullam,2019-12-05 11:04:14
"Ebola Syndrome, The (Yi boh laai beng duk)",71,ante nulla justo aliquam quis turpis eget elit sodales scelerisque mauris sit amet,2006-09-04 10:11:13
When the Game Stands Tall,71,sollicitudin ut suscipit a feugiat et eros vestibulum ac est lacinia,2017-07-05 05:58:43
"Bakery Girl of Monceau, The (La boulangère de Monceau)",35,dis parturient montes nascetur ridiculus mus vivamus vestibulum sagittis sapien cum,2012-01-05 13:26:25
"Heart of Me, The",33,lectus in est risus auctor sed tristique in tempus sit amet sem fusce consequat nulla nisl nunc nisl duis,2011-06-26 01:31:35
Piter FM,39,sapien in sapien iaculis congue vivamus metus arcu adipiscing molestie hendrerit at vulputate vitae,2010-04-27 02:08:18
"Leafie, a Hen Into the Wild (Madangeul Naon Amtak)",39,eros suspendisse accumsan tortor quis turpis sed ante vivamus tortor duis mattis egestas metus aenean fermentum donec ut,2017-11-19 06:38:05
Grandma's Boy,80,lorem ipsum dolor sit amet consectetuer adipiscing elit proin risus praesent lectus vestibulum,2007-12-17 18:45:49
Heavenly Forest,22,amet justo morbi ut odio cras mi pede malesuada in,2005-03-29 04:30:31
"Escapist, The",53,faucibus orci luctus et ultrices posuere cubilia curae donec pharetra magna,2020-05-12 14:07:04
"Alamo, The",60,quis libero nullam sit amet turpis elementum ligula vehicula consequat,2022-11-25 15:11:23
Dragon Fist (Long quan),51,lacinia nisi venenatis tristique fusce congue diam id ornare imperdiet sapien urna pretium nisl ut volutpat,2014-02-11 22:00:01
Cluny Brown,16,curae duis faucibus accumsan odio curabitur convallis duis consequat dui nec nisi volutpat eleifend donec,2021-05-21 21:18:08
Benji the Hunted,63,enim in tempor turpis nec euismod scelerisque quam turpis adipiscing lorem vitae mattis,2010-12-17 14:14:34
When Pigs Have Wings,53,parturient montes nascetur ridiculus mus vivamus vestibulum sagittis sapien cum sociis,2002-10-13 07:05:04
Resident Evil: Extinction,67,cubilia curae nulla dapibus dolor vel est donec odio justo sollicitudin ut suscipit a feugiat et,2013-05-10 07:36:17
Topaze,41,posuere cubilia curae duis faucibus accumsan odio curabitur convallis duis consequat dui nec,2013-09-10 05:58:39
Happy,37,ut dolor morbi vel lectus in quam fringilla rhoncus mauris enim leo rhoncus sed vestibulum sit amet cursus id,2001-05-04 05:42:05
Trust Me,34,montes nascetur ridiculus mus vivamus vestibulum sagittis sapien cum sociis natoque penatibus et magnis dis parturient montes,2004-04-20 13:55:01
"Cat in the Hat, The",7,non velit donec diam neque vestibulum eget vulputate ut ultrices vel augue vestibulum ante,2002-12-12 21:49:58
"Road to Brown, The",8,at ipsum ac tellus semper interdum mauris ullamcorper purus sit amet nulla quisque,2013-06-19 19:01:18
Empire Falls,45,orci luctus et ultrices posuere cubilia curae nulla dapibus dolor vel est donec odio justo,2004-03-15 08:15:07
Stella: Live in Boston,48,vestibulum ante ipsum primis in faucibus orci luctus et ultrices posuere cubilia curae mauris viverra diam vitae quam suspendisse,2015-02-12 00:02:35
Takva: A Man's Fear of God,33,accumsan odio curabitur convallis duis consequat dui nec nisi volutpat eleifend donec ut dolor,2011-01-23 21:54:34
"Wonderful Ice Cream Suit, The",26,diam cras pellentesque volutpat dui maecenas tristique est et tempus semper est,2013-09-27 19:19:47
The Snow White Murder Case,53,nec sem duis aliquam convallis nunc proin at turpis a pede posuere nonummy integer,2017-11-15 18:24:20
"Eclisse, L' (Eclipse)",65,in libero ut massa volutpat convallis morbi odio odio elementum,2017-04-21 01:08:28
"Party, The (Boum, La)",21,cursus urna ut tellus nulla ut erat id mauris vulputate elementum nullam varius nulla facilisi cras non velit nec nisi,2021-01-07 14:17:21
My Love Has Been Burning (Waga koi wa moenu),41,vulputate justo in blandit ultrices enim lorem ipsum dolor sit amet consectetuer adipiscing elit proin interdum mauris non ligula,2013-09-22 01:25:53
Invaders from Mars,68,interdum in ante vestibulum ante ipsum primis in faucibus orci luctus et ultrices posuere,2022-10-31 16:47:40
My Architect: A Son's Journey,26,ac consequat metus sapien ut nunc vestibulum ante ipsum primis in faucibus orci luctus,2012-08-13 07:10:00
High Strung,28,enim blandit mi in porttitor pede justo eu massa donec dapibus duis at velit,2009-08-04 22:30:31
Out Cold,23,et magnis dis parturient montes nascetur ridiculus mus etiam vel augue vestibulum rutrum rutrum neque aenean auctor gravida,2009-11-30 19:58:00
"Evening Star, The",28,lacus purus aliquet at feugiat non pretium quis lectus suspendisse potenti in eleifend quam a odio in hac,2004-08-19 12:32:18
Quartet,37,sit amet cursus id turpis integer aliquet massa id lobortis convallis tortor risus dapibus augue vel accumsan,2014-04-21 17:25:20
If You Love (Jos rakastat),61,pellentesque eget nunc donec quis orci eget orci vehicula condimentum curabitur in libero,2020-09-10 03:52:26
"Scalphunters, The",68,sapien dignissim vestibulum vestibulum ante ipsum primis in faucibus orci luctus,2000-09-30 13:54:05
Synth Britannia,79,pellentesque quisque porta volutpat erat quisque erat eros viverra eget congue,2003-01-16 19:27:07
Lonesome,71,fusce consequat nulla nisl nunc nisl duis bibendum felis sed interdum venenatis,2010-09-17 10:22:40
Damn the Defiant! (H.M.S. Defiant),43,a feugiat et eros vestibulum ac est lacinia nisi venenatis tristique fusce congue diam id ornare imperdiet sapien urna pretium,2014-05-21 22:24:37
